data_author,data_title,data_description,data_url,data_source,data_image,data_category,data_language,data_country,data_published_at,,,,,,
Amanda Marcotte,The Republican plot to get payback on Trump's behalf,The wheels of the last U.S. military plane were barely off the ground in Afghanistan when Republicans trotted out their plot to impeach President Joe Biden over ending the war.Using Politico, ground zero for the media pressure campaign to bully Biden into occupying that nation forever, the GOP rushed to concept test the idea of impeaching Biden in 2023. "The I-word looms: McCarthy faces internal pressure to go harder at Biden on Afghanistan, reads Politico's headline the morning after the withdrawal. Republicans [] want to make a high-stakes call for impeaching Biden over his handling of...,https://www.alternet.org/2021/09/trump-payback/,alternet,https://www.alternet.org/media-library/eyJhbGciOiJIUzI1NiIsInR5cCI6IkpXVCJ9.eyJpbWFnZSI6Imh0dHBzOi8vYXNzZXRzLnJibC5tcy8yNzM2NzE4MC9vcmlnaW4uanBnIiwiZXhwaXJlc19hdCI6MTY2OTg1ODIxMH0.PIbBGWMQS5jkPX-d3RgQ3KQI211pxlbXR2R8Va095y8/image.jpg?width=980,general,en,us,2021-09-01T00:18:43+00:00,,,
ABMN Staff,Bbva USA Invests $20.37 Million in The Walt Disney Company (NYSE:DIS),Bbva USA Invests $20.37 Million in The Walt Disney Company (NYSE:DIS),https://www.americanbankingnews.com/2021/08/31/bbva-usa-invests-20-37-million-in-the-walt-disney-company-nysedis.html,americanbankingnews,,general,en,us,2021-09-01T00:18:45+00:00,,,,,,
ABMN Staff,Uniper (ETR:UN01) Reaches New 1-Year High at $34.54,Uniper (ETR:UN01) Reaches New 1-Year High at $34.54,https://www.americanbankingnews.com/2021/08/31/uniper-etrun01-reaches-new-1-year-high-at-34-54.html,americanbankingnews,,general,en,us,2021-09-01T00:18:41+00:00,,,,,,
ABMN Staff,JPMorgan Chase &#038; Co. (NYSE:JPM) Stake Raised by Lockheed Martin Investment Management Co.,JPMorgan Chase &#038; Co. (NYSE:JPM) Stake Raised by Lockheed Martin Investment Management Co.,https://www.americanbankingnews.com/2021/08/31/jpmorgan-chase-co-nysejpm-stake-raised-by-lockheed-martin-investment-management-co.html,americanbankingnews,,general,en,us,2021-09-01T00:18:41+00:00,,,,,,
,Britney Spears' lawyers say father Jamie Spears is trying to 'extort' her with $2M request to resign,Lawyers for Britney Spears,39, argued that she was being 'extorted' by her father Jamie Spears,69, after they claimed in court filings that he was asking for $2 million to step down, TMZ reports.,https://www.dailymail.co.uk/tvshowbiz/article-9945409/Britney-Spears-lawyers-say-father-Jamie-Spears-trying-extort-2M-request-resign.html?ns_mchannel=rss&ito=1490&ns_campaign=1490,dailymail,https://i.dailymail.co.uk/1s/2021/09/01/00/47350881-0-image-m-27_1630453713712.jpg,general,en,us,2021-09-01T00:19:19+00:00,
City News Service,UCLA will mandate twice-weekly COVID-19 testing for unvaccinated people,The university had previously mandated once-weekly tests for everyone taking part in on-campus activities, regardless of vaccination status.,https://www.sgvtribune.com/2021/08/31/ucla-will-mandate-twice-weekly-covid-19-testing-for-unvaccinated-people/,sgvtribune,https://www.sgvtribune.com/wp-content/uploads/2021/08/OCR-L-VIRUS-TIERS-0722-01.mr_.jpg?w=1400px&strip=all,general,en,us,2021-09-01T00:18:21+00:00,,,,,
CST Editorial Board,Little Village’s 26th Street arch could become Chicago’s next landmark,The Little Village arch on 26th Street could take a step toward landmark status Thursday. | Ashlee Rezin/Sun-Times file We applaud the city for seeking landmark status for the Little Village arch and encourage the commission to give it the nod. Mexican American communities have been part of Chicago’s fabric since the late 19th century, yet despite those long roots — and the group’s significant population here — there are almost no landmarked structures reflecting that history.But the Commission on Chicago Landmarks might take a step toward fixing that omission.The panel is set to vote...,https://chicago.suntimes.com/2021/8/31/22648904/little-village-26th-street-arch-chicago-landmark-mexican-americans,suntimes,,general,en,us,2021-09-01T00:18:31+00:00,,,,,
Sabrina Schnur,14-year-old arrested in killing near UNLV,Las Vegas police have arrested a 14-year-old in connection with a deadly shooting this month near UNLV.,https://www.reviewjournal.com/crime/shootings/14-year-old-arrested-in-killing-near-unlv-2430893/,lvrj,,general,en,us,2021-09-01T00:19:48+00:00,,,,,,
AP News,USA Gymnastics eyes $425 million settlement with survivors,USA Gymnastics could be near the final stages of the legal fallout of the Larry Nassar sexual abuse scandal,https://www.mymotherlode.com/sports/olympics/1936223/usa-gymnastics-eyes-425-million-settlement-with-survivors.html,mymotherlode,,general,en,us,2021-09-01T00:16:58+00:00,,,,,,
-,This day in history | 1976 Water crisis deepens,The first of 11,500 standpipes have been connected in Yorkshire as local reservoirs reach their lowest levels in years. Yorkshire Water Authority (YWA) have said that current measures to save water have not been adequate and the standpipes could be in use in a fortnight’s time. About 750,000 people will be affected but the YWA [&#8230;],https://macaudailytimes.com.mo/this-day-in-history-1976-water-crisis-deepens.html?utm_source=rss&utm_medium=rss&utm_campaign=this-day-in-history-1976-water-crisis-deepens,macaudailytimes,,general,en,mo,2021-09-01T00:16:44+00:00,,,,
Alissa Noe,Prep Volleyball: Prairie showing promise early,Prairie volleyball welcomed a new head coach in DaShanda Bringelson and already, she seems to be making a positive impact. The Prairie Mustangs began the season with incredibly tough competition, first against Class 1A’s third-ranked Briggsdale and then against No. 10 Stratton/Liberty. The Mustangs struggled a bit against Briggsdale, but played the Falcons tough in [&#8230;],https://www.fortmorgantimes.com/2021/08/31/prep-volleyball-prairie-showing-promise-early/,fortmorgantimes,https://www.fortmorgantimes.com/wp-content/uploads/2021/08/FTM-L-2021-22PrairieHighSchoolVolleyball-01.jpg?w=1400px&strip=all,general,en,us,2021-09-01T00:18:59+00:00,,,
Rumita Patel,Badruddin Ajmal’s MLA Resigns, Ready to Join BJP Today | India News,GUWAHATI: A seated MLA from Badruddin Ajmal&#8217;s All India United Democratic Front (AIUDF) resigned from the party on Tuesday. It is the first time that an AIUDF legislator has resigned. Phanidhar Talukdar, MLA from the Bhabanipur legislative constituency, is likely to join the BJP here in the presence of Assam CM Himanta Biswa Sarma on...The post Badruddin Ajmal&#8217;s MLA Resigns, Ready to Join BJP Today | India News appeared first on TruthDive.,https://truthdive.com/2021/09/01/badruddin-ajmals-mla-resigns-ready-to-join-bjp-today-india-news/,truthdive,,general,en,us,2021-09-01T00:18:43+00:00,,
City News Service,UCLA will mandate twice-weekly COVID-19 testing for unvaccinated people,The university had previously mandated once-weekly tests for everyone taking part in on-campus activities, regardless of vaccination status.,https://www.dailybreeze.com/2021/08/31/ucla-will-mandate-twice-weekly-covid-19-testing-for-unvaccinated-people/,dailybreeze,https://www.dailybreeze.com/wp-content/uploads/2021/08/OCR-L-VIRUS-TIERS-0722-01.mr_.jpg?w=1400px&strip=all,general,en,us,2021-09-01T00:18:21+00:00,,,,,
ABMN Staff,Asset Management Corp IL ADV Purchases 18,086 Shares of AT&#038;T Inc. (NYSE:T),Asset Management Corp IL ADV Purchases 18,086 Shares of AT&#038;T Inc. (NYSE:T),https://www.americanbankingnews.com/2021/08/31/asset-management-corp-il-adv-purchases-18086-shares-of-att-inc-nyset.html,americanbankingnews,,general,en,us,2021-09-01T00:24:41+00:00,,,,
ABMN Staff,West Pharmaceutical Services, Inc. (NYSE:WST) Shares Sold by Smith Asset Management Group LP,West Pharmaceutical Services, Inc. (NYSE:WST) Shares Sold by Smith Asset Management Group LP,https://www.americanbankingnews.com/2021/08/31/west-pharmaceutical-services-inc-nysewst-shares-sold-by-smith-asset-management-group-lp.html,americanbankingnews,,general,en,us,2021-09-01T00:22:41+00:00,,,,
ABMN Staff,Zebra Technologies Co. (NASDAQ:ZBRA) Shares Sold by Smith Asset Management Group LP,Zebra Technologies Co. (NASDAQ:ZBRA) Shares Sold by Smith Asset Management Group LP,https://www.americanbankingnews.com/2021/08/31/zebra-technologies-co-nasdaqzbra-shares-sold-by-smith-asset-management-group-lp.html,americanbankingnews,,general,en,us,2021-09-01T00:22:41+00:00,,,,,,
ABMN Staff,Smith Asset Management Group LP Trims Holdings in AutoZone, Inc. (NYSE:AZO),Smith Asset Management Group LP Trims Holdings in AutoZone, Inc. (NYSE:AZO),https://www.americanbankingnews.com/2021/08/31/smith-asset-management-group-lp-trims-holdings-in-autozone-inc-nyseazo.html,americanbankingnews,,general,en,us,2021-09-01T00:22:41+00:00,,,,
ABMN Staff,Smith Asset Management Group LP Sells 10,376 Shares of Dover Co. (NYSE:DOV),Smith Asset Management Group LP Sells 10,376 Shares of Dover Co. (NYSE:DOV),https://www.americanbankingnews.com/2021/08/31/smith-asset-management-group-lp-sells-10376-shares-of-dover-co-nysedov.html,americanbankingnews,,general,en,us,2021-09-01T00:22:41+00:00,,,,
Cnn Com,Social Security won’t be able to pay full benefits by 2034, a year earlier than expected due to the pandemic,Social Security will have to cut benefits by 2034 if Congress does nothing to address the program's long-term funding shortfall, according to an annual report released Tuesday by the Social Security and Medicare trustees.,https://www.sgvtribune.com/2021/08/31/social-security-wont-be-able-to-pay-full-benefits-by-2034-a-year-earlier-than-expected-due-to-the-pandemic/,sgvtribune,https://www.sgvtribune.com/wp-content/uploads/2021/08/hypatia-h_a5d81843f60f7d97d7ad0d8b0064529c-h_471b8ebfeb0a71fafea511bd8c95138f.jpg?w=1400px&strip=all,general,en,us,2021-09-01T00:22:55+00:00,,,,
Cnn Com,Social Security won’t be able to pay full benefits by 2034, a year earlier than expected due to the pandemic,Social Security will have to cut benefits by 2034 if Congress does nothing to address the program's long-term funding shortfall, according to an annual report released Tuesday by the Social Security and Medicare trustees.,https://www.dailynews.com/2021/08/31/social-security-wont-be-able-to-pay-full-benefits-by-2034-a-year-earlier-than-expected-due-to-the-pandemic/,dailynews,https://www.dailynews.com/wp-content/uploads/2021/08/hypatia-h_a5d81843f60f7d97d7ad0d8b0064529c-h_471b8ebfeb0a71fafea511bd8c95138f.jpg?w=1400px&strip=all,general,en,us,2021-09-01T00:22:55+00:00,,,,
Russell Dorsey,Nico Hoerner (oblique) not ready for rehab assignment,Photo by Jonathan Daniel/Getty Images Hoerner has been on the 10-day injured list with a right oblique strain since July 29. The Cubs had hoped to see the versatile Nico Hoerner at several spots during the second half, unfortunately, that hasn’t happened.Hoerner has been on the 10-day injured list with a right oblique strain since July 29 and after feeling tension in the oblique, the team put his rehab assignment on pause. The Cubs’ infielder traveled with the team to Minneapolis and continued to add baseball activity before Tuesday’s game as he attempts to get his rehab back on track...,https://chicago.suntimes.com/cubs/2021/8/31/22651369/cubs-nico-hoerner-not-ready-for-rehab-assignment,suntimes,,general,en,us,2021-09-01T00:24:55+00:00,,,
Nyasa Times Reporter,Foreign consultant forcing Malawian garages to pay for Malawi govt motor traffic system MalTIS,What was raised as a matter of great concern at a stakeholder consultative meeting as a conflict of interest in the outsourcing of vehicle inspection services — held on March 8, 2016 at the Ministry of Transport — has now come to pass as the local garages are being made to pay to access the [&#8230;]The post Foreign consultant forcing Malawian garages to pay for Malawi govt motor traffic system MalTIS first appeared on Malawi Nyasa Times - News from Malawi about Malawi.,https://www.nyasatimes.com/foreign-consultant-forcing-malawian-garages-to-pay-for-malawi-govt-motor-traffic-system-maltis/,Nyasa Times,,general,en,mw,2021-09-01T00:21:45+00:00,,,,,
Linda Morris,Julia Ciccarone’s self-portrait wins Archibald Prize people’s choice award,The portrait, painted in the realistic tradition and titled The Sea Within, was selected from 52 Archibald finalists.,https://www.smh.com.au/culture/art-and-design/julia-ciccarone-s-self-portrait-wins-archibald-prize-people-s-choice-award-20210831-p58nh4.html?ref=rss&utm_medium=rss&utm_source=rss_culture,The Sydney Morning Herald,,entertainment,en,au,2021-09-01T00:21:22+00:00,,,,
Linda Morris,Julia Ciccarone’s self-portrait wins Archibald Prize people’s choice award,The portrait, painted in the realistic tradition and titled The Sea Within, was selected from 52 Archibald finalists.,https://www.smh.com.au/culture/art-and-design/julia-ciccarone-s-self-portrait-wins-archibald-prize-people-s-choice-award-20210831-p58nh4.html?ref=rss&utm_medium=rss&utm_source=rss_feed,The Sydney Morning Herald,,general,en,au,2021-09-01T00:21:22+00:00,,,,
Associated Press,Bali bomb case at Guantanamo runs into immediate challenges,It was a rocky start to a case already expected to be complex.,https://www.courthousenews.com/bali-bomb-case-at-guantanamo-runs-into-immediate-challenges/,courthousenews,,general,en,us,2021-09-01T00:21:46+00:00,,,,,,
Micheal Romero,Sierra Vista reminds residents to “park with care” near school zones,The Sierra Vista Police Department is asking residents to park and drive with care around neighborhood schools. The department says numerous parking violations have been reported in neighborhoods near elementary schools during student pick-up and drop-off times. SVPD wants to remind parents that every item in the list below is a parking violation under ArizonaThe post Sierra Vista reminds residents to &#8220;park with care&#8221; near school zones appeared first on KVOA.,https://kvoa.com/news/local-news/2021/08/31/sierra-vista-reminds-residents-to-park-with-care-near-school-zones/,kvoa,,general,en,us,2021-09-01T01:12:23+00:00,,,,,,
Cassandra Morgan,Second man arrested over alleged murder victim’s disappearance,Maryam Hamka,36, was last seen alive at a Woolworths in Brunswick on April 10.,https://www.theage.com.au/national/victoria/second-man-arrested-over-alleged-murder-victim-s-disappearance-20210901-p58nro.html?ref=rss&utm_medium=rss&utm_source=rss_national,The Age,,general,en,au,2021-09-01T01:11:22+00:00,,,,
unde0087,Astros vs Mariners over 8 -105,I am on this. I was going to make this a pro only thread but I want a few broke diks a chance to hammer me if I lose. Only fair. Runs will be scored. If not please everyone come and give me shit. Make it a 9 pager please. Fade away felonbitz Lets go :peace:,https://www.sportsbookreview.com/forum/players-talk/3672373-astros-vs-mariners-over-8-105-a.html,sbrforum,,general,en,us,2021-09-01T01:10:13+00:00,,,,,,
Scott Spits,Paralympics 2020 LIVE updates: Alcott chases doubles success, athletics medals on offer,It’s a day for Australia’s sprinters to shine. Sam Carter is Australia’s best chance on the track today in the T54 100m event, while Angela Ballard and Eliza Ault-Connell are also medal chances.,https://www.smh.com.au/sport/paralympics-2020-live-updates-alcott-chases-doubles-success-athletics-medals-on-offer-20210901-p58nsg.html?ref=rss&utm_medium=rss&utm_source=rss_feed,The Sydney Morning Herald,,general,en,au,2021-09-01T01:13:02+00:00,,,,
CBS New York,New York Jets Cut 2 Quarterbacks, Trade TE Chris Herndon,Tuesday was a busy day for the New York Jets.,https://newyork.cbslocal.com/2021/08/31/new-york-jets-giants-cuts-trades/,newyork,https://newyork.cbslocal.com/wp-content/uploads/sites/14578484/2019/07/gettyimages-1074695002.jpg?w=1024&h=576&crop=1,general,en,us,2021-09-01T01:13:16+00:00,,,,,
,Afghan U.S. ally forced to go into hiding as Taliban takes over,ABC15 spoke exclusively to a former Afghan U.S. interpreter, who we are not identifying, who says he has now gone into hiding.,https://www.onenewspage.com/video/20210901/14026828/Afghan-ally-forced-to-go-into.htm,onenewspage,,general,en,us,2021-09-01T01:13:12+00:00,,,,
Jeff Fletcher,Andrew Heaney looks back on Angels career with ‘regret’,Heaney returned to Angel Stadium this week as a member of the Yankees. His results have been uneven since the Yankees acquired him, similar to his career with the Angels.,https://www.pasadenastarnews.com/2021/08/31/andrew-heaney-looks-back-on-angels-career-with-regret/,pasadenastarnews,https://www.pasadenastarnews.com/wp-content/uploads/2021/08/imageedit_1_2416256515.jpg?w=1400px&strip=all,general,en,us,2021-09-01T01:12:00+00:00,,,,,
Mary Ward,Impossible to eliminate Delta, Premier says, as NSW COVID cases up by 1116,Gladys Berejiklian says the 70 per cent target can be reached by mid-October, urging her national cabinet colleagues to accept they need to reopen with ongoing cases.,https://www.brisbanetimes.com.au/national/nsw/impossible-to-eliminate-delta-premier-says-as-nsw-covid-cases-up-by-1116-20210901-p58nrr.html?ref=rss&utm_medium=rss&utm_source=rss_national,brisbanetimes,,general,en,au,2021-09-01T01:15:24+00:00,,,
Scott Spits,Paralympics 2020 LIVE updates: Alcott chases doubles success, athletics medals on offer,It’s a day for Australia’s sprinters to shine. Sam Carter is Australia’s best chance on the track today in the T54 100m event, while Angela Ballard and Eliza Ault-Connell are also medal chances.,https://www.watoday.com.au/sport/paralympics-2020-live-updates-alcott-chases-doubles-success-athletics-medals-on-offer-20210901-p58nsg.html?ref=rss&utm_medium=rss&utm_source=rss_feed,watoday,,general,en,au,2021-09-01T01:13:02+00:00,,,,
,‘Forever changed’: CEOs are dooming business travel - maybe for good,Business travel as we’ve known it is a thing of the past.,https://www.smh.com.au/business/companies/forever-changed-ceos-are-dooming-business-travel-maybe-for-good-20210901-p58npt.html?ref=rss&utm_medium=rss&utm_source=rss_business,The Sydney Morning Herald,,business,en,au,2021-09-01T01:07:16+00:00,,,,,,
odalys,Cuba pondrá en vigor normas jurídicas de las mipymes,Imagen principal:&nbsp;as normas jurídicas para la constitución de las micro, pequeñas y medianas empresas (mipymes) y la transformación de cooperativas no agropecuarias y el trabajo por cuenta propia entrarán en vigor el 20 de septiembre, informaron hoy fuentes oficiales.,http://cubasi.cu/en/node/188797,CubaSi.cu,,general,en,cu,2021-09-01T01:08:40+00:00,,,,
ABMN Staff,32,170 Shares in US Foods Holding Corp. (NYSE:USFD) Purchased by High Pointe Capital Management LLC,32,170 Shares in US Foods Holding Corp. (NYSE:USFD) Purchased by High Pointe Capital Management LLC,https://www.americanbankingnews.com/2021/08/31/32170-shares-in-us-foods-holding-corp-nyseusfd-purchased-by-high-pointe-capital-management-llc.html,americanbankingnews,,general,en,us,2021-09-01T01:10:41+00:00,,,,
ABMN Staff,High Pointe Capital Management LLC Acquires Shares of 9,070 Franco-Nevada Co. (NYSE:FNV),High Pointe Capital Management LLC Acquires Shares of 9,070 Franco-Nevada Co. (NYSE:FNV),https://www.americanbankingnews.com/2021/08/31/high-pointe-capital-management-llc-acquires-shares-of-9070-franco-nevada-co-nysefnv.html,americanbankingnews,,general,en,us,2021-09-01T01:10:41+00:00,,,,
ABMN Staff,Hedget Tops 24-Hour Trading Volume of $296,689.00 (HGET),Hedget Tops 24-Hour Trading Volume of $296,689.00 (HGET),https://www.americanbankingnews.com/2021/08/31/hedget-tops-24-hour-trading-volume-of-296689-00-hget.html,americanbankingnews,,general,en,us,2021-09-01T01:06:46+00:00,,,,
ABMN Staff,DeXe Market Cap Tops $54.43 Million (DEXE),DeXe Market Cap Tops $54.43 Million (DEXE),https://www.americanbankingnews.com/2021/08/31/dexe-market-cap-tops-54-43-million-dexe.html,americanbankingnews,,general,en,us,2021-09-01T01:06:42+00:00,,,,,,
ABMN Staff,Ormeus Cash (OMC) One Day Volume Hits $3.00,Ormeus Cash (OMC) One Day Volume Hits $3.00,https://www.americanbankingnews.com/2021/08/31/ormeus-cash-omc-one-day-volume-hits-3-00.html,americanbankingnews,,general,en,us,2021-09-01T01:06:42+00:00,,,,,,
ABMN Staff,China BlueChemical (OTCMKTS:CBLUY) Sets New 12-Month High at $6.98,China BlueChemical (OTCMKTS:CBLUY) Sets New 12-Month High at $6.98,https://www.americanbankingnews.com/2021/08/31/china-bluechemical-otcmktscbluy-sets-new-12-month-high-at-6-98.html,americanbankingnews,,general,en,us,2021-09-01T01:06:41+00:00,,,,,,
Wesley D Keefer,NFL preseason 2021 - 5 rookies who impressed the most,NFL preseason 2021 - 5 rookies who impressed the most,https://www.sportskeeda.com/nfl/nfl-preseason-2021-5-rookies-impressed?utm_source=feed&utm_medium=referral&utm_campaign=sportskeeda,Sportskeeda,https://static.sportskeeda.com/editor/2021/09/482f3-16304531428753-800.jpg,sports,en,us,2021-09-01T01:10:23+00:00,,,,,,
Michael Bockemuehl,Genshin Impact ascension materials for Kujou Sara: Ashen heart, Dendrobium, Storm Beads, and more,Genshin Impact ascension materials for Kujou Sara: Ashen heart, Dendrobium, Storm Beads, and more,https://www.sportskeeda.com/esports/genshin-impact-ascension-materials-kujou-sara-ashen-heart-dendrobium-storm-beads?utm_source=feed&utm_medium=referral&utm_campaign=sportskeeda,Sportskeeda,https://static.sportskeeda.com/editor/2021/09/d2fdf-16304490446280-800.jpg,sports,en,us,2021-09-01T01:10:23+00:00
Uday Maggon,An offer I couldn't refuse- CM Punk explains why he decided to join AEW ,An offer I couldn't refuse- CM Punk explains why he decided to join AEW ,https://www.sportskeeda.com/aew/news-cm-punk-explains-decided-join-aew?utm_source=feed&utm_medium=referral&utm_campaign=sportskeeda,Sportskeeda,https://static.sportskeeda.com/editor/2021/09/72e3c-16304503732653-800.jpg,sports,en,us,2021-09-01T01:10:23+00:00,,,,,,
Uday Maggon,The number one night of my career- CM Punk comments on his AEW debut,The number one night of my career- CM Punk comments on his AEW debut,https://www.sportskeeda.com/aew/news-cm-punk-comments-aew-debut?utm_source=feed&utm_medium=referral&utm_campaign=sportskeeda,Sportskeeda,https://static.sportskeeda.com/editor/2021/09/ca78e-16304464859825-800.jpg,sports,en,us,2021-09-01T01:10:23+00:00,,,,,,
Zachary Roberts,How many blocks are there in Minecraft 1.17?,How many blocks are there in Minecraft 1.17?,https://www.sportskeeda.com/minecraft/news-how-many-blocks-minecraft-1-17?utm_source=feed&utm_medium=referral&utm_campaign=sportskeeda,Sportskeeda,https://static.sportskeeda.com/editor/2021/09/0dd42-16304398822723-800.jpg,sports,en,us,2021-09-01T01:10:23+00:00,,,,,,
Jeff Mitton,Jeff Mitton: Natural Selections: Fly Agaric and related death cap mushrooms synthesize dangerous chemicals,A week of rain capped by a deluge from slow-moving thunderstorms brought seven mudslides into the Middle Fork Valley in the San Juan Mountains. The same rains triggered the appearance of many species of mushrooms, particularly fly agaric, Amanita muscaria.,https://www.dailycamera.com/2021/08/31/jeff-mitton-natural-selections-fly-agaric-and-related-death-cap-mushrooms-synthesize-dangerous-chemicals/,dailycamera,https://www.dailycamera.com/wp-content/uploads/2021/08/DCC-L-deathcap2.jpg?w=1400px&strip=all,general,en,us,2021-09-01T01:10:45+00:00,,,,
Jeff Fletcher,Andrew Heaney looks back on Angels career with ‘regret’,Heaney returned to Angel Stadium this week as a member of the Yankees. His results have been uneven since the Yankees acquired him, similar to his career with the Angels.,https://www.dailybulletin.com/2021/08/31/andrew-heaney-looks-back-on-angels-career-with-regret/,dailybulletin,https://www.dailybulletin.com/wp-content/uploads/2021/08/imageedit_1_2416256515.jpg?w=1400px&strip=all,general,en,us,2021-09-01T01:12:00+00:00,,,,,
Marc Berman,UCLA-grad Maxime Cressy pulls off stunning upset at US Open,American qualifier Maxime Cressy, ranked 151st, and a former UCLA player, stunned the U.S. Open’s ninth seed, Pablo Carreño Busta in a first-round shocker.,https://nypost.com/2021/08/31/us-open-ucla-grad-maxime-cressy-pulls-off-stunning-upset/,Post,https://nypost.com/wp-content/uploads/sites/2/2021/08/US-Open-Tennis-1-e1630457892409.jpg?quality=90&strip=all,general,en,zm,2021-09-01T01:05:12+00:00,,
